{
  "$schema": "https://json-schema.org/draft/2020-12/schema",
  "$id": "https://sustainablecatalyst.com/schemas/scfs-release-operations-v1.schema.json",
  "title": "Sustainable Catalyst Release Operations Report",
  "type": "object",
  "required": [
    "schema",
    "version",
    "generated_at",
    "summary",
    "products"
  ],
  "properties": {
    "schema": {
      "const": "scfs-release-operations/1.0"
    },
    "version": {
      "const": "7.8.1"
    },
    "generated_at": {
      "type": "string"
    },
    "summary": {
      "type": "object",
      "required": [
        "products",
        "active_plugins",
        "repositories",
        "current",
        "updates",
        "errors",
        "stale",
        "unconfigured",
        "semantic_tags",
        "no_releases"
      ],
      "properties": {
        "products": {
          "type": "integer",
          "minimum": 0
        },
        "active_plugins": {
          "type": "integer",
          "minimum": 0
        },
        "repositories": {
          "type": "integer",
          "minimum": 0
        },
        "current": {
          "type": "integer",
          "minimum": 0
        },
        "updates": {
          "type": "integer",
          "minimum": 0
        },
        "errors": {
          "type": "integer",
          "minimum": 0
        },
        "stale": {
          "type": "integer",
          "minimum": 0
        },
        "unconfigured": {
          "type": "integer",
          "minimum": 0
        },
        "semantic_tags": {
          "type": "integer",
          "minimum": 0
        },
        "no_releases": {
          "type": "integer",
          "minimum": 0
        }
      },
      "additionalProperties": false
    },
    "products": {
      "type": "array",
      "items": {
        "type": "object",
        "required": [
          "canonical_id",
          "name",
          "plugin_active",
          "repository_url",
          "operational_state",
          "freshness"
        ],
        "properties": {
          "canonical_id": {
            "type": "string"
          },
          "name": {
            "type": "string"
          },
          "lifecycle_state": {
            "type": "string"
          },
          "public_visible": {
            "type": "boolean"
          },
          "homepage_visible": {
            "type": "boolean"
          },
          "plugin_name": {
            "type": "string"
          },
          "plugin_active": {
            "type": "boolean"
          },
          "activation_scope": {
            "type": "string"
          },
          "installed_version": {
            "type": "string"
          },
          "repository_url": {
            "type": "string"
          },
          "github_sync_enabled": {
            "type": "boolean"
          },
          "github_sync_state": {
            "type": "string"
          },
          "github_sync_message": {
            "type": "string"
          },
          "github_version": {
            "type": "string"
          },
          "github_version_source": {
            "type": "string"
          },
          "public_version": {
            "type": "string"
          },
          "status": {
            "type": "string"
          },
          "last_synced_at": {
            "type": "string"
          },
          "freshness": {
            "enum": [
              "current",
              "aging",
              "stale",
              "never",
              "unknown",
              "error"
            ]
          },
          "operational_state": {
            "enum": [
              "current",
              "semantic_tag",
              "connected_no_release",
              "update_available",
              "error",
              "authentication_required",
              "repository_unavailable",
              "rate_limited",
              "network_error",
              "stale",
              "never",
              "unknown",
              "unconfigured"
            ]
          },
          "plugin_file": {
            "type": "string"
          },
          "github_connection_state": {
            "type": "string"
          },
          "github_sync_error_code": {
            "type": "string"
          },
          "github_sync_http_status": {
            "type": "string"
          },
          "github_sync_endpoint": {
            "type": "string"
          },
          "github_sync_endpoint_url": {
            "type": "string"
          },
          "github_sync_failed_at": {
            "type": "string"
          },
          "github_commit_sync_warning": {
            "type": "string"
          }
        },
        "additionalProperties": false
      }
    }
  },
  "additionalProperties": false
}
